{
  "schema_name": "longlineage.audit_evidence",
  "schema_version": "1.0.0",
  "snapshot_id": "20260719-foundation-verification-002",
  "task_id": "20260719-foundation",
  "scope": {
    "kind": "REPOSITORY",
    "completeness": "FULL",
    "description": "Full tracked LongLineage foundation source snapshot and governed synthetic verification.",
    "included_paths": [
      "."
    ],
    "excluded_paths": []
  },
  "source_snapshot_kind": "GIT_COMMIT",
  "source_commit": "8b62261a384bd2dd2a469f5b2ad27df2e34f3c8d",
  "source_tree_sha256": "eb59c1f1856692569729742378d00ca396ad3a1ed125bc4aa0b395903a155bd3",
  "source_dirty": false,
  "commands": [
    {
      "command_id": "clang-format-14",
      "argv": [
        "scripts/ci/check_format.sh",
        "/tmp/clang-format-14-root/usr/bin/clang-format-14"
      ],
      "working_directory": ".",
      "exit_code": 0,
      "stdout_sha256": "420fb63862661535eb8af4c491443804c32964a032d53cddbe74711c8cff0209",
      "stderr_sha256": "e3b0c44298fc1c149afbf4c8996fb92427ae41e4649b934ca495991b7852b855",
      "started_at": "2026-07-19T09:05:52+08:00",
      "completed_at": "2026-07-19T09:05:53+08:00"
    },
    {
      "command_id": "check-all-debug",
      "argv": [
        "scripts/ci/check_all.sh",
        "build-verify-debug"
      ],
      "working_directory": ".",
      "exit_code": 0,
      "stdout_sha256": "98b1251692b6ad3377f2ddce7e220fc1907369b81a6be7bcb7a14d3b16b402c7",
      "stderr_sha256": "e3b0c44298fc1c149afbf4c8996fb92427ae41e4649b934ca495991b7852b855",
      "started_at": "2026-07-19T09:06:01+08:00",
      "completed_at": "2026-07-19T09:06:57+08:00"
    },
    {
      "command_id": "check-all-release",
      "argv": [
        "scripts/ci/check_all.sh",
        "build-verify-release"
      ],
      "working_directory": ".",
      "exit_code": 0,
      "stdout_sha256": "dd624634eb3bbd1efed4b88db84cd831a6e152697eb1228bba826aa493853632",
      "stderr_sha256": "e3b0c44298fc1c149afbf4c8996fb92427ae41e4649b934ca495991b7852b855",
      "started_at": "2026-07-19T09:07:04+08:00",
      "completed_at": "2026-07-19T09:08:00+08:00"
    },
    {
      "command_id": "ctest-asan-ubsan",
      "argv": [
        "/usr/bin/env",
        "ASAN_OPTIONS=detect_leaks=0",
        "UBSAN_OPTIONS=halt_on_error=1:print_stacktrace=1",
        "/usr/bin/ctest",
        "--test-dir",
        "build-verify-sanitize",
        "--output-on-failure"
      ],
      "working_directory": ".",
      "exit_code": 0,
      "stdout_sha256": "6d20c2dbc1260f385c9fa173027922809367374c2bb4e46a0a68c15f3148e69a",
      "stderr_sha256": "e3b0c44298fc1c149afbf4c8996fb92427ae41e4649b934ca495991b7852b855",
      "started_at": "2026-07-19T09:08:07+08:00",
      "completed_at": "2026-07-19T09:08:45+08:00"
    },
    {
      "command_id": "prior-audit-source-replay",
      "argv": [
        "scripts/ci/check_audit_source_snapshot.sh",
        "state/audits/20260719-foundation-verification-001.json"
      ],
      "working_directory": ".",
      "exit_code": 0,
      "stdout_sha256": "a854d94eb227c62ea721245e14c71dd1ede3a88b7caa3e0e9940634881494553",
      "stderr_sha256": "e3b0c44298fc1c149afbf4c8996fb92427ae41e4649b934ca495991b7852b855",
      "started_at": "2026-07-19T09:08:58+08:00",
      "completed_at": "2026-07-19T09:09:23+08:00"
    },
    {
      "command_id": "ai-readiness",
      "argv": [
        "scripts/ai/check_readiness.sh",
        "build-verify-debug"
      ],
      "working_directory": ".",
      "exit_code": 0,
      "stdout_sha256": "93d07e0104724ccf787c90debacf05d6b20e24c8e441e5d5f7165bb97f2809f0",
      "stderr_sha256": "e3b0c44298fc1c149afbf4c8996fb92427ae41e4649b934ca495991b7852b855",
      "started_at": "2026-07-19T09:09:36+08:00",
      "completed_at": "2026-07-19T09:09:38+08:00"
    }
  ],
  "captured_at": "2026-07-19T09:09:38+08:00",
  "captured_by_agent_id": "codex:root",
  "supersedes": [
    "20260719-foundation-verification-001"
  ],
  "superseded_by": null,
  "supersession_reason": "Evidence binding exposed and repaired incomplete audit dependencies in negative-test scratch repositories."
}
